<?xml version="1.0" encoding="UTF-8"?>
<AluguerCampos xmlns="http://www.aluguercampos.com/reserva_campo"
               xmlns:xsi="http://www.w3.org/2001/XMLSchema-instance"
               xsi:schemaLocation="http://www.aluguercampos.com/reserva_campo.xsd">
    <Campo>
        <Nome>Campo de Futebol 1</Nome>
        <Localizacao>Rua, 123</Localizacao>
        <Tipo>Futebol</Tipo>
        <PrecoPorHora>50.00</PrecoPorHora>
        <Horarios>
            <Horario>
                <Dia>Segunda-feira</Dia>
                <HorarioAbertura>10:00:00</HorarioAbertura>
                <HorarioFecho>22:00:00</HorarioFecho>
            </Horario>
            <Horario>
                <Dia>Terça-feira</Dia>
                <HorarioAbertura>10:00:00</HorarioAbertura>
                <HorarioFecho>22:00:00</HorarioFecho>
            </Horario>
	    <Horario>
                <Dia>Quarta-feira</Dia>
                <HorarioAbertura>10:00:00</HorarioAbertura>
                <HorarioFecho>22:00:00</HorarioFecho>
            </Horario>
            <Horario>
                <Dia>Quinta-feira</Dia>
                <HorarioAbertura>10:00:00</HorarioAbertura>
                <HorarioFecho>22:00:00</HorarioFecho>
            </Horario>
            <Horario>
                <Dia>Sexta-feira</Dia>
                <HorarioAbertura>10:00:00</HorarioAbertura>
                <HorarioFecho>22:00:00</HorarioFecho>
            </Horario>
            <Horario>
                <Dia>Sabado</Dia>
                <HorarioAbertura>08:00:00</HorarioAbertura>
                <HorarioFecho>22:00:00</HorarioFecho>
            </Horario>
            <Horario>
                <Dia>Domingo</Dia>
                <HorarioAbertura>08:00:00</HorarioAbertura>
                <HorarioFecho>12:00:00</HorarioFecho>
            </Horario>
        </Horarios>
 </Campo>
 <Campo>
        <Nome>Campo de Futebol 2</Nome>
        <Localizacao>Rua, 456</Localizacao>
        <Tipo>Futebol</Tipo>
        <PrecoPorHora>50.00</PrecoPorHora>
        <Horarios>
            <Horario>
                <Dia>Segunda-feira</Dia>
                <HorarioAbertura>10:00:00</HorarioAbertura>
                <HorarioFecho>22:00:00</HorarioFecho>
            </Horario>
            <Horario>
                <Dia>Terça-feira</Dia>
                <HorarioAbertura>10:00:00</HorarioAbertura>
                <HorarioFecho>22:00:00</HorarioFecho>
            </Horario>
	    <Horario>
                <Dia>Quarta-feira</Dia>
                <HorarioAbertura>10:00:00</HorarioAbertura>
                <HorarioFecho>22:00:00</HorarioFecho>
            </Horario>
            <Horario>
                <Dia>Quinta-feira</Dia>
                <HorarioAbertura>10:00:00</HorarioAbertura>
                <HorarioFecho>22:00:00</HorarioFecho>
            </Horario>
            <Horario>
                <Dia>Sexta-feira</Dia>
                <HorarioAbertura>10:00:00</HorarioAbertura>
                <HorarioFecho>22:00:00</HorarioFecho>
            </Horario>
            <Horario>
                <Dia>Sabado</Dia>
                <HorarioAbertura>08:00:00</HorarioAbertura>
                <HorarioFecho>22:00:00</HorarioFecho>
            </Horario>
            <Horario>
                <Dia>Domingo</Dia>
                <HorarioAbertura>08:00:00</HorarioAbertura>
                <HorarioFecho>12:00:00</HorarioFecho>
            </Horario>
        </Horarios>
 </Campo>
 <Campo>
        <Nome>Campo de Futebol 3</Nome>
        <Localizacao>Rua, 789</Localizacao>
        <Tipo>Futebol</Tipo>
        <PrecoPorHora>50.00</PrecoPorHora>
        <Horarios>
            <Horario>
                <Dia>Segunda-feira</Dia>
                <HorarioAbertura>10:00:00</HorarioAbertura>
                <HorarioFecho>22:00:00</HorarioFecho>
            </Horario>
            <Horario>
                <Dia>Terça-feira</Dia>
                <HorarioAbertura>10:00:00</HorarioAbertura>
                <HorarioFecho>22:00:00</HorarioFecho>
            </Horario>
	    <Horario>
                <Dia>Quarta-feira</Dia>
                <HorarioAbertura>10:00:00</HorarioAbertura>
                <HorarioFecho>22:00:00</HorarioFecho>
            </Horario>
            <Horario>
                <Dia>Quinta-feira</Dia>
                <HorarioAbertura>10:00:00</HorarioAbertura>
                <HorarioFecho>22:00:00</HorarioFecho>
            </Horario>
            <Horario>
                <Dia>Sexta-feira</Dia>
                <HorarioAbertura>10:00:00</HorarioAbertura>
                <HorarioFecho>22:00:00</HorarioFecho>
            </Horario>
            <Horario>
                <Dia>Sabado</Dia>
                <HorarioAbertura>08:00:00</HorarioAbertura>
                <HorarioFecho>22:00:00</HorarioFecho>
            </Horario>
            <Horario>
                <Dia>Domingo</Dia>
                <HorarioAbertura>08:00:00</HorarioAbertura>
                <HorarioFecho>12:00:00</HorarioFecho>
            </Horario>
        </Horarios>
 </Campo>
 <Campo>
        <Nome>Campo de Tenis 1</Nome>
        <Localizacao>Rua, 123</Localizacao>
        <Tipo>Futebol</Tipo>
        <PrecoPorHora>50.00</PrecoPorHora>
        <Horarios>
            <Horario>
                <Dia>Segunda-feira</Dia>
                <HorarioAbertura>10:00:00</HorarioAbertura>
                <HorarioFecho>22:00:00</HorarioFecho>
            </Horario>
            <Horario>
                <Dia>Terça-feira</Dia>
                <HorarioAbertura>10:00:00</HorarioAbertura>
                <HorarioFecho>22:00:00</HorarioFecho>
            </Horario>
	    <Horario>
                <Dia>Quarta-feira</Dia>
                <HorarioAbertura>10:00:00</HorarioAbertura>
                <HorarioFecho>22:00:00</HorarioFecho>
            </Horario>
            <Horario>
                <Dia>Quinta-feira</Dia>
                <HorarioAbertura>10:00:00</HorarioAbertura>
                <HorarioFecho>22:00:00</HorarioFecho>
            </Horario>
            <Horario>
                <Dia>Sexta-feira</Dia>
                <HorarioAbertura>10:00:00</HorarioAbertura>
                <HorarioFecho>22:00:00</HorarioFecho>
            </Horario>
            <Horario>
                <Dia>Sabado</Dia>
                <HorarioAbertura>08:00:00</HorarioAbertura>
                <HorarioFecho>22:00:00</HorarioFecho>
            </Horario>
            <Horario>
                <Dia>Domingo</Dia>
                <HorarioAbertura>08:00:00</HorarioAbertura>
                <HorarioFecho>12:00:00</HorarioFecho>
            </Horario>
        </Horarios>
 </Campo>
 <Campo>
        <Nome>Campo de Tenis 2</Nome>
        <Localizacao>Rua, 123</Localizacao>
        <Tipo>Futebol</Tipo>
        <PrecoPorHora>50.00</PrecoPorHora>
        <Horarios>
            <Horario>
                <Dia>Segunda-feira</Dia>
                <HorarioAbertura>10:00:00</HorarioAbertura>
                <HorarioFecho>22:00:00</HorarioFecho>
            </Horario>
            <Horario>
                <Dia>Terça-feira</Dia>
                <HorarioAbertura>10:00:00</HorarioAbertura>
                <HorarioFecho>22:00:00</HorarioFecho>
            </Horario>
	    <Horario>
                <Dia>Quarta-feira</Dia>
                <HorarioAbertura>10:00:00</HorarioAbertura>
                <HorarioFecho>22:00:00</HorarioFecho>
            </Horario>
            <Horario>
                <Dia>Quinta-feira</Dia>
                <HorarioAbertura>10:00:00</HorarioAbertura>
                <HorarioFecho>22:00:00</HorarioFecho>
            </Horario>
            <Horario>
                <Dia>Sexta-feira</Dia>
                <HorarioAbertura>10:00:00</HorarioAbertura>
                <HorarioFecho>22:00:00</HorarioFecho>
            </Horario>
            <Horario>
                <Dia>Sabado</Dia>
                <HorarioAbertura>08:00:00</HorarioAbertura>
                <HorarioFecho>22:00:00</HorarioFecho>
            </Horario>
            <Horario>
                <Dia>Domingo</Dia>
                <HorarioAbertura>08:00:00</HorarioAbertura>
                <HorarioFecho>12:00:00</HorarioFecho>
            </Horario>
        </Horarios>
 </Campo>
 <Campo>
        <Nome>Campo de Padel 1</Nome>
        <Localizacao>Rua, 123</Localizacao>
        <Tipo>Futebol</Tipo>
        <PrecoPorHora>50.00</PrecoPorHora>
        <Horarios>
            <Horario>
                <Dia>Segunda-feira</Dia>
                <HorarioAbertura>10:00:00</HorarioAbertura>
                <HorarioFecho>22:00:00</HorarioFecho>
            </Horario>
            <Horario>
                <Dia>Terça-feira</Dia>
                <HorarioAbertura>10:00:00</HorarioAbertura>
                <HorarioFecho>22:00:00</HorarioFecho>
            </Horario>
	    <Horario>
                <Dia>Quarta-feira</Dia>
                <HorarioAbertura>10:00:00</HorarioAbertura>
                <HorarioFecho>22:00:00</HorarioFecho>
            </Horario>
            <Horario>
                <Dia>Quinta-feira</Dia>
                <HorarioAbertura>10:00:00</HorarioAbertura>
                <HorarioFecho>22:00:00</HorarioFecho>
            </Horario>
            <Horario>
                <Dia>Sexta-feira</Dia>
                <HorarioAbertura>10:00:00</HorarioAbertura>
                <HorarioFecho>22:00:00</HorarioFecho>
            </Horario>
            <Horario>
                <Dia>Sabado</Dia>
                <HorarioAbertura>08:00:00</HorarioAbertura>
                <HorarioFecho>22:00:00</HorarioFecho>
            </Horario>
            <Horario>
                <Dia>Domingo</Dia>
                <HorarioAbertura>08:00:00</HorarioAbertura>
                <HorarioFecho>12:00:00</HorarioFecho>